<?xml version="1.0" encoding="utf-8" ?>
<!--
  - SPDX-FileCopyrightText: 2018 Nextcloud GmbH and Nextcloud contributors
  - SPDX-License-Identifier: MIT
-->
<release xmlns:xsi= "http://www.w3.org/2001/XMLSchema-instance"
         xsi:noNamespaceSchemaLocation="../../schema.xsd"
         version="13.0.0">
    <changelog href="https://nextcloud.com/changelog/#13-0-0"/>
    <whatsNew lang="en">
        <regular>
            <item>Refined user interface</item>
            <item>End-to-End Encryption</item>
            <item>Video and Text Chat</item>
        </regular>
        <admin>
            <item>Changes to the Nginx configuration</item>
            <item>Theming: CSS files were consolidated</item>
        </admin>
    </whatsNew>
</release>
